object_id,text,text_type,label,ai_model
formal_d7f5f262,"Ben 7 adalah sinetron yang diproduksi oleh Rapi Films ditayangkan di TPI. Sinetron ini diadaptasi dengan kartun Ben 10 yang diproduksi oleh Cartoon Network.Padepokan Merpati Putih heboh... Guru-guru besar padepokan Merpati Putih yang sedang bertapa, mau membuka rahasia ilmu sebuah kitab langka, yaitu kitab tanpa huruf, shock begitu melihat kitab tiba-tiba terbang ke atas dan terbuka sendiri. Dari kitab muncul satu hawa kekuatan yang sangat dahsyat. BAM Sedetik kemudian hawa kekuatan berubah sosok menjadi seorang pendekar yang sangat sakti yang kemudian langsung menyerang guru-guru besar padepokan Merpati Putih. Akhirnya terjadi pertarungan sengit antara guru-guru besar padepokan dan pendekar sakti penjaga kitab. Tapi biarpun dikeroyok, ternyata pendekar sakti bukan tandingan guru-guru besar padepokan Merpati Putih. Hanya dalam beberapa gebrakan, guru-guru besar padepokan Merpati Putih semua dibuat keok dan roboh. Pendekar sakti lalu kembali masuk ke dalam kitab. Di saat bersamaan murid-murid padepokan yang mendengar suara teriakan guru-guru besar padepokan muncul. Semua terkesiap melihat guru-guru besar mereka yang terkenal sakti roboh bergelimpangan. Hening... Semua tercekat diam tak percaya... Di sudut ruangan tampak kitab sakti yang kembali berubah seperti kitab usang biasa, menyimpan rahasia besarnya. Kehilangan guru-guru besar mereka, padepokan Merpati Putih akhirnya berkabung besar. Ruangan bertapa dikunci dan dirubah fungsi menjadi gudang penyimpanan kitab-kitab sakti. Tapi kemudian muncul masalah baru. Di gudang sekarang sering terjadi kejadian-kejadian aneh. Ada bangku terbang, suara orang ketawa cekikikan, dsb. Tidak ada yang tahu kalau semua kejadian aneh tersebut sebenarnya berasal dari pendekar sakti yang tinggal di dalam kitab sakti tanpa huruf. Murid-murid padepokan terlanjur ketakutan dan menganggap gudang penyimpanan kitab sekarang angker dan berhantu. Tidak ada satupun yang berani datang ke gudang sendirian apalagi malam hari. Cerita kemudian beralih ke BEN (7 tahun, nama panjangnya Benyamin), salah satu murid padepokan Merpati Putih yang paling kecil tapi sekaligus juga paling nakal, jahil, dan suka mengerjai murid-murid padepokan Merpati Putih yang lainnya. Ada tiga orang murid padepokan yang paling sering dikerjain sama Ben SITI, CHAPLIN dan CAPUNG (masing-masing 9-10 tahun). Alasannya ketiga anak ini suka meledek dan meremehkan Ben, menganggap diri mereka sok senior, mentang-mentang Ben paling kecil di antara mereka. Suatu hari Ben yang kembali mengerjai Siti, Caplin dan Capung ketangkap basah sama KYAI BUSTOMI, guru besar padepokan. Kyai Bustomi lalu menghukum Ben, menyuruhnya untuk membersihkan gudang tempat penyimpanan kitab-kitab sakti yang terkenal angker. Ben kontan ketakutan. Sebaliknya Siti, Chaplin dan Capung kegirangan. Diam-diam mereka menyimpan rencana mau menakut-nakuti Ben di gudang angker untuk balas dendam mereka... Usaha Siti, Chaplin dan Capung berhasil. Ben sampai terkencing-kencing ketakutan di dalam gudang karena ulah terror Siti, Chaplin dan Capung. Tapi ternyata, justru dari sinilah Ben kemudian mengalami satu peristiwa yang sangat penting dalam hidupnya. Di gudang Ben secara tidak sengaja kemudian menemukan kitab tanpa huruf. Dari dalam kitab kemudian muncul pendekar sakti yang dulu mengalahkan guru-guru besar padepokan Merpati putih sambil tertawa-tawa geli melihat tingkah Ben. Ben yang awalnya mengira kalau si pendekar sakti tersebut adalah hantu makin terkencing-kencing ketakutan. Tapi si pendekar sakti lalu memperkenalkan dirinya, bilang kalau ia bukan hantu jahat, dan ia muncul cuma karena ingin jadi sahabat Ben. Melihat sikap pendekar sakti yang ramah, Ben akhirnya menyambut uluran tangan si pendekar. JREENG Saat melihat telapak tangan Ben, pendekar sakti terkejut. Di telapak tangan Ben ada tujuh tahi lalat yang bersinar. Pendekar sakti bilang kalau Ben adalah jodohnya. Ben adalah orang yang bakal mewarisi seluruh ilmu dan kesaktiannya. Ben jadi kebingungan. BYAARR Di saat bersamaan, tiba-tiba sekujur tubuh Ben di selimuti cahaya-cahaya keemasan. Terakhir cahaya-cahaya tersebut kemudian menyatu dan berubah jadi sebuah sabuk sakti yang membelit pinggang Ben. Pendekar sakti bilang, sabuk tersebut akan memberikan Ben 7 kekuatan yang maha dahsyat. Tapi sebelumnya, Ben harus mencari rahasia masing-masing kekuatan yang ada dalam sabuk tersebut. Awalnya Ben masih belum percaya. Tapi sebuah bencana di dalam gudang kemudian membuka mata Ben... Siti, Chaplin dan Capung yang mau mengerjai Ben dengan bayangan hantu-hantuan di tembok dengan menggunakan cahaya lilin tanpa sengaja menjatuhkan lilin ke tumpukan kitab-kitab sakti di dalam gudang. Dalam sekejap api lilin langsung menyambar kitab-kitab dan membuat gudang kebakaran. Siti, Chaplin dan Capung jadi histeris dan teriak-teriak ketakutan. Ben terkesiap, panik, tidak tahu harus berbuat apa untuk menolong teman-temannya. BLAZH Dalam kepanikan tiba-tiba sabuk pinggang sakti Ben bersinar. DUM Sedetik kemudian tubuh Ben berubah jadi manusia api yang bisa terbang. Dengan kekuatan tersebut Ben akhirnya bisa menyelamatkan Siti, Chaplin dan Capung. Ben terkesiap. Ternyata ucapan pendekar tidak main-main. Ben jadi girang bukan kepalang, mau memberitahu kekuatan barunya pada orang-orang padepokan. Tapi pendekar sakti mengingatkan Ben, kekuatan baru Ben tidak boleh diberitahu siapapun, jika tidak, Ben bakal celaka. Ben akhirnya menyimpan rahasia kekuatan barunya rapat-rapat. Kitab tanpa huruf yang menyimpan rahasia pendekar sakti juga selalu disimpan Ben di balik pakaiannya. Kedua benda tersebut kini menjadi sahabat baru Ben... Teman Ben bertambah banyak. Sejak kejadian kebakaran dalam gudang, Chaplin dan Capung yang merasa berhutang budi akhirnya juga mau jadi sahabat Ben dan bahkan menganggap Ben sebagai ketua geng mereka yang baru. Tapi berbeda dengan Siti. Siti yang sebenarnya diam-diam mulai simpati sama Ben, tetap jaga gengsi. Pura-pura terus memusuhi Ben, padahal dalam hati kepengen juga diajak main sama Ben... Suatu hari, Siti yang masih sebal sama Ben kembali mengerjai Ben. Siti mengundang Ben datang ke pesta ulangtahunnya. Di pesta itu, Siti kemudian dengan sengaja memanas-manasi Ben yang yatim piatu, sok mesra-mesraan sama orangtuanya hingga membuat Ben jadi cemburu. Terakhir Ben yang tidak tahan juga terus dipanas-panasi Siti akhirnya berlari pergi sambil menangis meninggalkan rumah Siti. Ternyata kejadian itu berakibat panjang. Sepulang dari pesta, Ben langsung menemui bang Komeng, juru masak istana. Ben langsung mencak-mencak marah sama bang Komeng. Bang Komeng adalah juru masak padepokan yang sejak kecil merawat Ben. Bang Komeng selalu bilang pada Ben, kalau Ben tidak punya orangtua. Ben lahir dari batu, Ben anak batu. Sekarang Ben sudah tidak percaya lagi. Apalagi setelah tadi ia melihat Siti. Bang Komeng jadi gelagapan. Selama ini, bersama Kyai Bustomi ia memang menyimpan rahasia besar tentang siapa Ben sebenarnya. Ben jadi makin curiga dan terus mendesak bang Komeng, mencecarnya dengan pertanyaan siapa kedua orangtuanya yang sebenarnya. Tapi bang Komeng tetap tutup mulut. Ben akhirnya berlalu pergi sambil menahan kesal. Tapi Ben ternyata bukannya menyerah. Ben yang cerdik merancang sebuah rencana untuk membuat bang Komeng buka mulut menceritakan rahasianya. Ben tahu kelemahan bang Komeng. Selama ini bang Komeng sebenarnya sembunyi di padepokan menjadi juru masak untuk menghindar dari seorang wanita sakit ingatan yang punya ilmu silat tinggi dan terus mengejar-ngejarnya. Namanya, Zubaedah. Ben, Capung dan Chaplin lalu mempertemukan Zubaedah dengan bang Komeng. Zubaedah kontan histeris dan mengejar-ngejar bang Komeng sampai masuk ke dalam padepokan. Padepokan jadi heboh. Bang Komeng kelabakan mencari tempat ngumpet. Tapi lagi-lagi Ben mengerjai bang Komeng, memberitahu Zubaedah tempat persembunyian bang Komeng. Bang Komeng akhirnya jadi kewalahan, mengaku menyerah pada Ben sambil berjanji, ia akan menceritakan rahasia Ben asalkan Ben mengusir Zubaedah. Singkat cerita Ben akhirnya berhasil mengusir Zubaedah. Bang Komeng mau tidak mau menepati janjinya menceritakan satu rahasia besar, siapa kedua orangtua Ben sebenarnya. Kedua orangtua Ben sebenarnya masih hidup. Ayah Ben bernama PAK TIRTA, seorang miliarder di kota Jakarta. Dan ibu Ben bernama MURNI. Sejak dulu, ayah Ben sangat mempercayai ramalan. Waktu Ben lahir, peramal bilang kalau Ben kelak bakal jadi bencana buat ayah Ben. Itu sebabnya Ben makanya diasingkan, dititipkan di daerah terpencil yakni di padepokan Merpati Putih. Pak Tirta tidak tahu kalau sebenarnya peramal tersebut adalah orang jahat, salah satu kaki tangan BANG JAPRA, rekanan bisnis pak Tirta yang ingin menguasai seluruh harta pak Tirta. Sekarang pak Tirta sendiri lagi sakit-sakitan. Sebenarnya sakit pak Tirta karena diguna-guna oleh peramal kepercayaannya sendiri atas suruhan bang Japra. Tujuannya selama pak Tirta sakit, bang Japra bisa bebas berkuasa atas tampuk kepemimpinan perusahaan pak Tirta. Pak Tirta sendiri memang mempunyai enam orang anak selain Ben. Tapi sayang ke enam anak pak Tirta ini tidak bisa diandalkan, bodoh, rakus dan tamak, hingga gampang diperdayai oleh bang Japra. Pak Tirta akhirnya cuma bisa pasrah. Tidak bisa berbuat apa-apa. Ia tahu, selain licik, bang Japra memiliki ilmu silat yang sangat sakti. Bang Japra adalah bekas tukang pukulnya. Dan pak Tirta seringkali melihat bang Japra menggunakan kekuatannya saat merontokkan saingan-saingan usahanya. Sebenarnya, pak Tirta tidak setuju dengan cara itu. Tapi makin lama, bang Japra makin menunjukkan taringnya. Ia tidak mau lagi menghiraukan perintah pak Tirta dan malah berbuat sesuka hatinya sendiri. Mendengar cerita tersebut. Ben jadi naik pitam. Ia ingin kembali ke rumah ayahnya. Tapi bang Komeng bilang, belum saatnya Ben kembali. Masalahnya bang Japra punya ilmu kekuatan yang sangat sakti. Belum lagi ditambah anak buahnya yang juga punya kekuatan rata-rata di atas murid Merpati Putih yang paling senior sekalipun saat ini. Tapi Ben terlanjur penasaran. Malam harinya, di saat kyai Bustomi, bang Komeng dan semua penghuni padepokan Merpati Putih tidur, diam-diam Ben pergi meninggalkan padepokan dan kembali ke Jakarta. Ben akhirnya memulai petualangan baru. Di Jakarta, ia bertemu dengan bang Japra dan anak buahnya yang ingin menyingkirkan Ben. Kekuatan mereka sangat dahsyat. Tapi berbekal kitab sakti dan kekuatan sabuk, Ben bisa melewati satu persatu tantangan yang harus ia hadapi dari bang Japra CS. Terakhir, Ben akhirnya memiliki tujuh kekuatan. Tujuh kesaktian yang maha dahsyat, hingga ahirnya Ben dijuluki... BEN 7",formal_document,0,human
formal_a4d50818,"Spesifiksi tank - tank KV adalah sebagai berikut. Panjang 6.675mm Lebar 3.320mm Tinggi 2.710mm ""Ground clearance"" 450mm Kru 5 (Supir, Komandan, Penembak, Pemuat, dan penembak senapan mesin) Berat 47.5 ton Armor(mm) -Depan (atas) 7530 -Depan (tengah) 6070 -Depan (bawah) 7525 -Samping (kanan dan kiri) 750 -Bawah 30-40 -Atas 30-40 -Turret 90(mask tools) 7520(depan) 7515(samping dan belakang) 40(atap turret) Senjata dan kaliber L-11 76.2mm dan F-32 76.2mm Senjata lain 3x 7.62mm senapan mesin DT Pandangan kru Teleskop TOD-6 dan periskop PT-6 Mesin V-2 mesin diesel V-12 4 langkah Tenaga 600 tenaga kuda Transmisi 5 maju dan 1 mundur Kecepatan maksimum 34kmjam Suspensi ""Torsion bar"" Panjang 6.950mm Lebar 3.320mm Tinggi 3.250mm ""Ground clearance"" 430mm Kru 6 Berat 52 ton Armor(mm) -Depan (atas) 7530 -Depan (tengah) 6070 -Depan (bawah) 7525 -Samping (kanan dan kiri) 750 -Bawah 30-40 -Atas 30-40 -Turret 110(mask tools) 75(depan) 75(samping dan belakang) 40(atap turret) Senjata dan kaliber M-10 Howitzer 152.4mm Senjata lain 3x 7.62mm senapan mesin DT Pandangan kru Teleskop TOD-9, Periskop Fri-9 dan panorama komandan PT-K Mesin V-2 mesin diesel V-12 4 langkah Tenaga 600 tenaga kuda Transmisi 5 maju dan 1 mundur Kecepatan maksimum 34kmjam Suspensi ""Torsion bar"" Panjang 6.675mm Lebar 3.320mm Tinggi 2.710mm ""Ground clearance"" 450mm Kru 5 (Supir, Komandan, Penembak, Pemuat, dan penembak senapan mesin) Berat 52 ton Armor(mm) -Depan (atas) 7530 -Depan (tengah) 6070 -Depan (bawah) 7525 -Samping (kanan dan kiri) 750 -Bawah 30-40 -Atas 30-40 -Turret 90(mask tools) 7520(depan) 7515(samping dan belakang) 40(atap turret) Senjata dan kaliber 20K anti-tank gun 45mm Senjata lain 3x 7.62mm senapan mesin DT dan penyembur api ATO-41 Pandangan kru Teleskop TOD-6 dan periskop PT-6 Mesin V-2 mesin diesel V-12 4 langkah Tenaga 600 tenaga kuda Transmisi 5 maju dan 1 mundur Kecepatan maksimum 34kmjam Suspensi ""Torsion bar"" Panjang 6.675mm Lebar 3.320mm Tinggi 2.710mm ""Ground clearance"" 450mm Kru 5 (Supir, Komandan, Penembak, Pemuat, dan penembak senapan mesin) Berat 42.5 ton Armor(mm) -Depan (atas) 7530 -Depan (tengah) 6070 -Depan (bawah) 7525 -Samping (kanan dan kiri) 750 -Bawah 30-40 -Atas 30-40 -Turret 90(mask tools) 7520(depan) 7515(samping dan belakang) 40(atap turret) Senjata dan kaliber F-34 76.2mm atau ZiS-5 76.2mm Senjata lain 3x 7.62mm senapan mesin DT Pandangan kru Teleskop TOD-6 dan periskop PT-6 Mesin V-2 mesin diesel V-12 4 langkah Tenaga 600 tenaga kuda Transmisi 5 maju dan 1 mundur Kecepatan maksimum 42kmjam Suspensi ""Torsion bar"" Tank - tank KV sangat mudah dimodifikasi sehingga pada 1942, Uni Soviet mulai merancang tank baru dengan dasar dari tank - tank KV. Berikut daftar modifikasi dari tank KV. KV-3 atau Objekt 223 merupakan salah satu prototype tank kelas berat Uni Soviet yang dirancang pada tahun 1941. KV-3 dibuat oleh SKB-2 yang termasuk dalam Pabrik - pabrik Kirov. KV-3 memiliki berat 68 ton, panjang 7.850mm, lebar 3.410mm, tinggi 2.950mm dan berground clearance 450mm. KV-3 memakai senjata ZiS-6 kaliber 107mm dan 3 senapan mesin DT-29 kaliber 7.62mm. Selain itu, KV-3 memiliki daya mesin 850 tenaga kuda dan berkecepatan 30kmjam. KV-4 hanyalah sebuah rancangan tank yang hingga Uni Soviet runtuh tidak dibuat satupun. KV-4 dirancang oleh 11 teknisi terkenal Soviet, yakni Sergei Fedorenko, K. Buganova, L. Pereverzev, Nikolai Strukova, Mikhail Kreslavsky, Nikolai Shashmurina, P. Tarantina, Konstantin Kuzmina, Vladimir Tarotkov dan Nikolai Dukhov. Sama halnya dengan KV-4, KV-5 juga merupakan rancangan tank kelas super berat yang tidak dibuat satu unitpun. KV-5 memakai ZiS-6 107mm sebagai senjata utama dan 3 senapan mesin DT 7.62mm serta 3 senapan mesin anti-pesawat DShK 12.7mm. KV-220 atau Objekt 220 merupakan tank kelas berat, tank terobosan dan tank serbu rancangan Uni Soviet yang dibuat pada 1940 dan selesai pada 1941 dan menghasilkan 1 unit. KV-220 memakai F-30 kaliber 85mm sebagai senjata utama dan 3 senapan mesin DT sebagai senjata kedua. KV-85 atau Objekt 239 merupakan tank kelas berat Uni Soviet yang menjadi cikal bakal dari KV-13 dan IS-1. KV-85 menggunakan D-5T kaliber 85mm sebagai senjata utama 3 senapan mesin DT-29. KV-85 dikembangkan pada 1943 setelah Perang Kursk ketika salah satu tank Tiger Nazi Jerman ditembak oleh senjata anti-pesawat 52-K pada jarak 1.000m mengalami kerusakan pada armor depannya. Maka sebagai ganti dari 52-K, Uni Soviet mengembangkan D-5T kaliber 85mm yang kemudian dipasang pada KV-85. KV-100 hanyalah sebuah rancangan tank kelas berat Uni Soviet yang dirancang pada tahun 1943 dan tidak ada satupun produksinya. KV-100 menggunakan S-34 kaliber 100mm sebagai senjata utama dan 3 senapan mesin berat DT kaliber 7.62mm. KV-122 merupakan tank kelas berat Uni Soviet yang memakai dasar dari tank KV-85 tetapi menggunakan senjata D-25T kaliber 122mm sebgaia senjata utamanya. KV-122 dikembangkan pada 1944 dan hanya diproduksi 1 unit. SU-152 merupakan ""Self-Propelled Artillery"" buatan Uni Soviet yang memakai dasar dari KV-1S. SU-152 memakai senjata ML-20S Howitzer sebagai senjata utamanya yang dapat menjebol armor tank Tiger dan Panther Nazi Jerman pada jarak 1.500m sehingga disebut oleh tentara Merah Soviet dengan nama ""Zveroboy"" yang artinya pemburu binatang(Nazi). Selain dapat menjebol armor Tiger dan Pather, SU-152 juga dapat menghancurkan bunker dengan ketebalan 1m pada jarak 1.500m. Berat peluru SU-152 yang mencapai 50kg dibuat menjadi 2 jenis, yakni penghancur beton dan penghancur tank. KV-13 merupakan rancangan tank kelas berat Uni Soviet yang dibuat pada tahun 1943 dan menggunakan D-5T 85mm pada prototype pertama dan D-25T 122mm pada prototype kedua. KV-13 lalu menjadi rancangan tank kelas berat Uni Soviet, yakni IS-1 (IS-85) dan IS-122 (IS-2).",formal_document,0,human
formal_0785f8ef,"Seusai upacara tanggal 20 Mei 1958, diadakan rapat panitia. Rapat berhasil membentuk Panitia Monumen Setengah Abad Kebangkitan Nasional yang anggotanya terdiri dari anggota Dewan Pimpinan Panitia Peringatan Setengah Abad Kebangkitan Nasional Yogyakarta. Sebagai tempat berdirinya monumen Sri Sultan Hamengkubuwana IX memberikan sebagian halaman nDalem Brontokusuman. Adapun susunan dari panitia tersebut, sebagai berikut Selanjutnya untuk membahas apa dan bagaimana monumen itu kelak, panitia monumen setengah abad kebangkitan nasional membentuk panitia khusus. Karena jumlah anggota dari panitia ini berjumlah sembilan orang, maka sering disebut dengan Panitia Sembilan. Adapun susunan panitia sembilan tersebut adalah sebagai berikut Pada tanggal 22 Mei 1958 panitia khusus mengadakan rapat di gedung Japendi (Jawatan Penerangan). Rapat membahas masalah-masalah yang berkaitan dengan kepanitiaan, arti penting monumen, letak monumen, bentuk monumen, sumber dana, dan rencana kerja. Pada tanggal 7 Juli 1958, dalam rapat pleno yang dipimpin oleh Sri Sultan Hamengkubuwono IX panitia monumen setengah abad kebangkitan nasional menyetujui apa yang telah direncanakan dan dikerjakan oleh panitia khusus. Untuk merealisasikaimya, maka dalam rapat tersebut dibentuk dua panitia kecil. Adapun susunan kepanitiaan tersebut sebagai berikut Rapat juga menunjuk Mr. Soedarisman Poerwokoesoemo untuk menghubungi penguruspanitia yang dulu pernah dibentuk untuk mengambil alih pekerjaan mereka dan diminta supaya menunjuk sekarang wakilnya untuk duduk dalam Panitia Monumen Setengah Abad Kebangkitan Nasional. Perlu disampaikan bahwa di Yogyakarta sejak tanggal 2 Desember 1952 telah dibentuk panitia sementara yang bermaksud merencanakan berdirinya sebuah museum perjuangan yang akan digunakan untuk menyimpan dan memelihara benda-benda yang dipergunakan oleh rakyat Indonesia pada masa perjuangan kemerdekaan. Adapun susunan kepanitiaan pada waktu itu adalah Selanjutnya Panitia Sementara Museum Perjuangan menyerahkan barang-barang yang berhasil dikumpulkannya, antara lain berupa Sejak saat itu kata Museum Perjuangan mulai digunakan lagi, dan menggeser kepopuleran kata Monumen Setengah Abad Kebangkitan Nasional. Berita-berita yang muncul di koran-koran juga mendorong perubahan penyebutan dari Monumen Setengah Abad Kebangkitan Nasional menjadi Museum Perjuangan. Karena itulah, pada tanggal 14 Mei 1959 Museum Pusat TNI AD menghubungi Panitia Monumen Setengah Abad Kebangkitan Nasional di Yogyakarta dengan mengutus Kapten Kamari Sampurno untuk mengadakan pembicaraan dengan Soetardjo selaku Sekretaris Panitia Monumen Setengah Abad Kebangkitan Nasional di Yogyakarta. Dalam rapat pleno keempat tanggal 19 Juni 1959, ketua panitia teknik Prof. Ir. Soewandi memberikan penjelasan tentang rencana dan bentuk bangunan. Ide bentuk bangunan muncul dari Sri Sultan Hamengkubuwana IX. Museum akan berbentuk bulat, sedang ornamen-ornamen akan diambilkan dari macam-macam candi. Terkait dengan masalah permohonan dana ke pemerintah pusat, ditunjuk Soetardjo (Kepala Djapendi Yogyakarta) selaku Sekretaris Panitia Monumen Setengah Abad Kebangkitan Nasional. Hasilnya pemerintah RI sanggup memberikan dana Rp 8.000.000, serta menyanggupkan diri hadir dalam peringatan 10 tahun Yogya Kembali. Pada tanggal 29 Juni 1959 di Gedung Negara Yogyakarta (Gedung Agung) diadakan peringatan 10 tahun Yogya Kembali yang dihadiri oleh tokoh-tokoh selama Agresi Militer Belanda II. Sebagai wakil pemerintah pusat hadir Wakil Perdana Menteri I Mr. Hardi yang mewakili Perdana Menteri Ir. Djuanda yang waktu itu sedang berada di luar negeri. Berkenan memberikan sambutan dalam acara tersebut antara lain Kepala Daerah dan Ketua DPRD Siswosoemarto dan Wakil Perdana Menteri I Mr. Hardi. Dalam sambutannya, Wakil Perdana Menteri I Mr. Hardi, mewakili pemerintah menyatakan persetujuannya terhadap pendirian Museum Perjuangan di Yogyakarta. Pada tanggal 1 Juli 1959 bertempat di Gedung Wilis, Kepatihan, Yogyakarta, diadakan rapat pleno yang kelima. Rapat dipimpin oleh Sri Sultan Hamengkubuwana IX. Dalam rapat tersebut berhasil dibentuk seksi-seksi beserta anggota. Adapun seksi-seksi tersebut antara lain Seksi l (Pembangunan Gedung Museum) Seksi II (Pengumpulan Barang-barang dari pihak sipil) Seksi III (Pengumpulan Barang-barang dari pihak militer) Seksi IV (Usaha sesudah Museum Jadi dan dibuka) Seksi V (Relief) Seksi VI (Administrasi Keuangan) Seksi VII (Penerangan dan Propaganda) Laporan pelaksanaan tugas seksi-seksi tersebut disampaikan dalam rapat pleno tanggai 26 Juli 1959. Dengan mempertimbangkan masukan dan laporan-laporan dari tiap seksi maka ditetapkan bahwa pada tanggal 17 Agustus 1959 dilakukan pemasanan patok pertama kali. Upacara pemasangan patok pertama dilakukan halaman ndalem Brontokusuman Yogyakarta. Upacara ini berlangsung tepat 12.00 WIB usai upacara resmi di Gedung Negara Yogyakarta (Gedung Agung) selesai. Hadir dalam acara tersebut antara lain para pembesar sipil maupun militer beserta tamu undangan. Karena Sri Sultan Hamengkubuwana IX sedang menjalani tugasnya di tempat lain maka pemasangan patok pertama dilaksakan oleh Sri Paku Alam VIII. Dengan demikian sudah dapat dipastikan tanda dimana gedung Museum Perjuangan Yogyakarta nantinya akan dibangun. Pada tanggal 21 Agustus 1959 diadakan rapat pleno yang ke tujuh. Rapat ini dipimpin oleh Ketua Panitia Sri Sultan Hamengkubuwana IX dan bertempat di Gedung Wilis, Kepatihan, Yogyakarta. Dalam rapat tersebut Sri Sultan Hamengkubuwana IX melaporkan hasil kunjungannya selama di Jakarta, antara lain keberhasilannya menemui Perdana Menteri Ir. Djuanda dan Menteri Keamanan Nasional Letnan Jenderal A.H. Nasution. Mengenai uang Rp8.000.000,00 (delapan juta rupiah) dari pemerintah pusat akan diatur dalam 3 termin, yaitu Pada tanggal 1 September 1959 diadakan pertemuan antara Seksi I (Pembangunan Gedung Museum) dengan para pemborong yang datang dari berbagai kota besar di Jawa seperti dari Jakarta, Bandung, Semarang, Solo, Surabaya, Malang dan Yogyakarta. Pertemuan tersebut diadakan di ruang Perpustakaan Djapendi. Penjelasan mengenai gambar proyek gedung museum dan cara-cara memasukkan penawaran diberikan oleh Soedarman. Setelah melalui pemikiran, perhitungan biaya dan memasukkan penawaran, maka pada tanggal 28 September 1959 bertempat di Japendi, diadakan pertemuan pelelangan gedung Museum Perjuangan yang dihadiri oleh para pemborong yang telah memasukkan penawaran. Surat-surat penawaran dibuka, penawar tertinggi adalah E.I.C (Indonesian Engineering Corporation) dengan penawaran mendekati Rp 7.000.000. Dengan demikian I.E.C. merupakan pemenang dalam lelang pembangunan Museum Perjuangan. Surat pemberian pekerjaan dan kontrak telah diselesaikan oleh ketua direksi Soedarman (Kepala Djawatan Gedung-gedung Negeri di Yogyakarta). Sebagai awal pembangunan gedung Museum Perjuangan, pada tanggal 5 Oktober 1959, bertepatan dengan Hari Angkatan Perang, dilakukan pencangkulan pertama. Kegiatan itu dilaksanakan setelah usai upacara peringatan hari Angkatan Perang di Makam Pahlawan Kusuma Negara Semaki, Yogyakarta. Upacara pencangkulan pertama berlangsung di ndalem Brontokusuman, dengan didahului kata pembukaan oleh sekretaris panitia Soetardjo, disusul dari direksi yang melaporkan jalannya pelelangan. Yang ketiga adalah dari pemborong yang disampaikan oleh Poegoeh (EYD Puguh) dari I.E.C.selanjutnya pembacaan doa oleh Kyai Haji Badawi. Akhirnya Sri Paku Alam VIII selaku Wakil Kepala Daerah Daerah Istimewa Yogyakarta berkenan memberikan amanatnya. Selanjutnya para hadirin dipersilahkan menuju ke halaman muka mengelilingi patok yang teiah dipancangkan tanggal 17 Agustus 1959. Ayunan cangkul pertama dilakukan oleh Paku Alam VIII selaku Wakil Kepala Daerah Daerah Istimewa Yogyakarta bersama para pembesar sipil, militer, polisi dan lain-lain. Dengan selesainya upacara pencangkulan pertama ini, pembangunan bangunan gedung museum dimulai. Sesuai dengan laporan sekretariat dan seksi V (relief) pada sidang pleno ke sembilan tanggal 7 April 1960, Panita Monumen Setengah Abad Kebangkitan Nasional di Yogyakarta telah membuat dua macam sayembara yaitu Menurut rencana, sayembara ini akan ditutup tanggal 30 Juni 1960, tetapi mengingat ada beberapa kiriman naskah sayembara yang tidak sampai kepada alamat yang dituju (kembali) maka atas persetujuan rapat pleno, penutupan sayembara diundur sampai dengan tanggal 31 Juli 1960. Pada permulaan bulan Agustus 1960, setelah diadakan pemeriksaan, ternyata terdapat 44 gambar yang memenuhi syarat. Gambar-gambar tersebut meliputi gambar hiasan puncak dan kesatuan patung gerilya. Menurut hasil pemeriksa panitia ahli selaku juri, tidak ada gambar yang memenuhi keinginan panitia, hingga tidak ada hadiah pertama yang dapat diberikan. Untuk sayembara hiasan puncak menurut penilian juri hanya ada satu yang mendekati keinginan panitia yaitu gambar yang berjudul ""Purna Swaraj"". Gambar inilah yang dinilai no. 2 dan dapat dipakai meski harus dengan beberpa perubahan. Sebagai penghargaan kepada penciptanya diberikan uang sebesar Rp 20.000,- (dua puluh ribu rupah). Untuk gambar Kesatuan Patung Gerilya hanya dapat hadiah sebesar Rp 5.000,- (lima ribu rupiah) kepada gambar yang berjudul ""Mara Hanung"". Selanjutnya kepada F. A. Sutjipto, pencipta gambar hiasan puncak tersebut diminta menyempurnakan hasil kerjanya dengan petunjuk dari panitia ahli, yang pelaksanaannya diserahkan kepada Katamsi sebagai panasehatnya.",formal_document,0,human
