object_id,text,text_type,label,ai_model
formal_5a8dc263,"LAMPIRAN PELATURAN MENTERI DALAM NEGRI RIPUBLIK INDONESIA NOMOR 13 TAHUN 2012 TENTANG MONOGRAFI DESA DAN KELURAHAN BUKU MONOGRAFI DESA KEADAAN PADA BULAN JANUARI SD OKTOBER TAHUN 2015 1. Nama Desa CIHEA 2. Tahun Pembentukan 1887 3. Dasar Hukum Pembentukan ADAT 4. Nomor Kode Wilayah 32.05.131.002 5. Nomor Kode Pos 43283 6. Kecamatan HAURWANGI 7. Kabupaten Kota CIANJUR 8. Provinsi JAWA BARAT A. DATA UMUM 1. Tipologi Desa a Persawahan 146,692 Ha Kerajinan dan industri kecil - Ha industri sedang dan Besar - Ha Jasa dan Perdagangan - Ha 2. Tingkat Perkembangan Desa Swasembada Swadaya Swakarsa 3. Luas wilayah 2.401 Ha 4. Batas wilayah a. Sebelah Utara Desa Sukatani Kecamatan Haurwangi b Sebelah Selatan Desa Baranangsiang Kabupaten Bandung Barat c Sebelah Barat Desa Mandalawangi Kabupaten Bandung Barat d Sebelah Timur Desa kemang Kecamatan Bojongpicung 5. Orbitrasi ( Jarak dari Pusat Pemerintahan ) a. Jarak dari Pusat Pemerintahan 700 Km b Jarak dari Pusat Pemerintahan Kota 40 Km c Jarak dari Kota Ibu kota Kabupaten 35 Km d Jarak dari ibu kota Provinsi 70 Km 6. Jumlah Tanah bersetifikat 4 Ha. 7. Luas Tanah kas Desa 8.128 M2 8. Jumlah Penduduk 8.079 Jiwa a. Laki - Laki 3.128 Jiwa b Perempuan 2.986 Jiwa c Usia 0 - 15 2.725 Jiwa d Usia 15 - 65 4.530 Jiwa f Usia 65 Ke Atas 873 Jiwa 9. Pekerjaan Mata pencaharian Pertanian perkebunan a Karyawan 321 orang 1 Pegawai Negri Sipil 14 orang 2 Tni Polri 1 orang 3 Swasta 168 orang b Wiraswasta Pedagang 142 orang c Petani 1.097 orang d Tukang 91 orang e Buruh Tani 990 orang f Pensiunan 22 orang g Nelayan - orang h Peternak - orang i Jasa 5 orang j Pengrajin 8 orang k Pekerja seni 2 orang l Lainya 16 orang m Tidak bekerja Penganggur 242 orang 10. Tingkat Pendidikan Masyarakat a Lulusan Pendidikan UMUM 1 Taman kanak kanak 59 orang 2 Sekolah Dasar sederajat 864 orang 3 SMP 264 orang 4 SMA SMU 153 orang 5 Akademi D1- D3 3 orang 6 Sarjana 2 orang 7 Pasca sarjana - orang b Lulusan Pendidikan khusus 1 Pondok pesantren 27 orang 2 Pendidikan keagamaan 5 orang 3 Sekolah luar biasa 1 orang 4 Kursus keterampilan 8 orang c Tidak Lulus dan tidak sekolah Tidak Lulus - orang Tidak bersekolah - orang 11. Jumlah penduduk miskin 1.523 Jiwa 1.100 KK ( menurut Standar Bps ) 12. UMR Kabupaten Kota Rp 830.000 13. Sarana Prasarana a Kantor Desa Semi permanen b Prasarana Kesehatan 1 Puskesmas Tidak - buah 2 Poskesdes Ada 1 buah 3 UKBM ( posyandu, polindes ) Ada 11 buah c Prasarana Pendidikan 1 Perpustakaan Desa Ada 1 buah 2 Gedung Sekolah PAUD Ada 2 buah 3 Gedung Sekolah TK Ada 2 buah 4 Gedung Sekolah SD Ada 3 buah 5 Gedung Sekolah SMP Ada 1 buah 6 Gedung Sekolah SMA Tidak - buah 7 Gedung Sekolah perguruan tinggi Tidak - buah d Prasarana ibadah 1 Masjid Ada 19 buah 2 Mushola Ada 89 buah 3 Gereja Tidak - buah 4 Pura Tidak - buah 5 Vihara Tidak - buah 6 Klenteng Tidak - buah e Prasarana Umum 1 Olah Raga Ada 6 buah 2 Kesenian Budaya Ada 2 buah 3 Sumur Desa Ada 6 buah 4 Balai pertemuan Ada 2 buah 5 Pasar Desa Tidak - buah 6 Lainnya Tidak - buah B. DATA PERSONIL 1 Kades a Nama SUPRIATNA b Pendidikan terakhir SLTA c Pelatihan yang pernah di ikuti Diklat Pemerintahan Desa d TMT masa jabatan 14 Juni 2007 e Jenis kelamin Laki-Laki 2 Sekretaris Desa a Nama HERI HERMAWAN b Pangkat GOL PNS c NIP d Pendidikan terakhir S 1 e Pelatihan yang pernah di ikuti Diklat Bimtek Pemerintahan Desa f TMT masa jabatan g Jenis kelamin Laki-Laki 3 1 Perangkat Desa a Nama RONI RUSTANDI b Pendidikan terakhir SLTA c Pelatihan yang pernah di ikuti d TMT masa jabatan 15 Jauari 2015 e Jenis klamin Laki-Laki 3 2 Perangkat Desa a Nama ALI NURDIN b Pendidikan terakhir SMA c Pelatihan yang pernah di ikuti 1 BPD d TMT masa jabatan 20 Pebruari 2008 3 3 Perangkat Desa a Nama ASEP SOLIHIN b Pendidikan terakhir SMA c Pelatihan yang pernah di ikuti d TMT masa jabatan 04 Januari 2010 e Jenis klamin Laki-Laki 3 4 Perangkat Desa a Nama EVAN SUTIANA b Pendidikan terakhir SMP c Pelatihan yang pernah di ikuti d TMT masa jabatan 04 Januari 2010 a Jenis Kelamin 5 Perangkat Desa 3a Nama DENI HENDRA PERMANA b Pendidikan Terakhir SLTA a Jenis Kelamin Laki-Laki b Perangkat Desa c Nama AGUS BADRU JAMAN d Pendidikan terakhir SLTA 6 3 a Jenis klamin Laki-Laki b Perangkat Desa c Nama AGUS SAEPULOH d Pendidikan terakhir SMP e 7 3 a Jenis klamin Laki-Laki 3 a Jenis klamin Laki-Laki 3 a Jenis klamin Laki-Laki 3 a Jenis klamin Laki-Laki 4 a Jenis klamin Laki-Laki 3 5 6 4 a Jenis klamin Laki-Laki C a Jenis klamin D Urusan yang di serahkan oleh kabupaten kota Bantuan ADD E - Sumber Tunjangan F c Jenis kegiatan 11",formal_document,0,human
formal_45190947,"Prasangka merupakan hasil dari interaksi sosial, maka prasangka sebagian besar disebabkan oleh faktor sosial. Berikut terdapat beberapa teori psikologi yang dapat menjelaskan bagaimana faktor sosial yang telah dijelaskan diatas dapat menyebabkan munculnya prasangka dan mengapa prasangka muncul dalam interaksi sosial, yaitu teori konflik realistik, teori belajar sosial, teori kognitif,teori psikodinamika, teori kategorisasi sosial, teori perbandingan sosial, teoribiologi dan deprivasi relative Teori ini memandang bahwa terjadinya kompetisi (biasanya persaingan memperoleh sumber-sumber langka, seperti ekonomi dan kekuasaan) dan konflik antar kelompok dapat meningkatkan kecenderungan untuk berprasangka dan mendiskriminasikan anggota out group. Kompetisi yang terjadi antara dua kelompok yang saling mengancam akan menimbulkan permusuhan dan menciptakan penilaian negatif yang bersifat timbale balik. Jadi, prasangka merupakan konsekuensi dari konflik nyata yang tidak dapat dielakan. Judd dan Park (1988) menyatakan bahwa ketika kelompok ada dalam situasi kompetisi maka akan memunculkan efek homogenitas out group , yaitu kecenderungan untuk m elihat semua anggota dari out group adalah sama atau homogen semakin intensif. LeVine dan Campbel (1972) menyebut kompetisi yang terjadi sebagai konflik kelompok yang realistik. Biasanya terjadi karena kedua kelompok bersaing untuk memperebutkan sumber langka yang sama. Contoh dari teori konflik realistik adalah prasangka anti-Negro di Selatan (Amerika Serikat) yang menyatakan bahwa penyebabnya adalah konflik kelompok yang realistis. Pada saat itu, di daerah Selatan relatif miskin, dan sangat tergantung pada perkebunan kapuk dan tembakau, serta industri yang relatif kecil. Ladang kerja sedikit dan jauh, sehingga kelas pekerja berdasarkan jenis kulit mengalami persaingan. Individu negro merupakan pekerja yang tidak terampil dan kurang terdidik berusaha memperebutkan ladang kerja yang langka itu dengan individu kulit putih yang pada dasarnya merupakan pekerja yang terampil dan terdidik. Berdasarkan teori, konflik yang terjadi antara kedua kelompok tersebut menumbuhkan rasialisme dan menunjang timbulnya diskriminasi kerja terhadap individu Negro, karena individu kulit putih memiliki kekuatan ekonomi dan politik yang lebih besar. Menurut teori belajar sosial, prasangka adalah sesuatu yang dipelajari seperti halnya individu belajar nilai-nilai sosial yang lain. Prasangka biasanya diperoleh anak-anak melalui proses sosialisasi. Anak-anak banyak yang menginternalisasikan norma-norma mengenai stereotipe dan perilaku antar kelompok yang ditetapkan oleh orang tua dan teman sebaya. Selain dari orang tua dan teman sebaya, media massa juga menjadi sumber anak untuk mempelajari stereotipe dan prasangka. Contoh dari teori belajar sosial adalah di Amerika, banyak anak kulit putih yang mungkin melihat tuanya bersikap diskriminatif terhadap individu kulit hitam, mendengar ucapan-ucapan orang tuanya yang meremehkan kulit hitam, dan melarang anaknya untuk bermain dengan anak-anak kulit hitam. Dalam perkembangan selanjutnya, mereka akan mendengar pembicaraan teman-teman sebayanya yang mengatakan bahwa individu kulit hitam adalah jelek dan mereka akan dikucilkan jika kelihatan bermain dengan kulit hitam. Orang tua mereka juga menekankan cerita-cerita yang mengatakan individu kulit hitam merupakan pelanggar hukum. Sehingga dari kejaadian-kejadian tersebut anak diajarkan untuk berprasangka terhadap individu kulit hitam. Anak-anak memiliki model orang tua dan teman sebaya yanag berprasangka dan juga menghukum jika ia bermain dengan individu kulit hitam, dengan demikian anak belajar untuk membenci kulit hitam. menjelaskan bagaimana cara individu berpikir mengenai prasangka (objek yang dijadikan sasaran untuk diprasangkai) dan bagaimana individu memproses informasi dan memahami secara subjektif mengenai dunia dan individu lain. Dalam mengamati individu lain, seseorang berusaha mengembangkan kesan yang terstruktur mengenai individu lain dengan cara melakukan proses kategorisasi. Kategorisasi sering kali didasarkan pada isyarat yang sangat jelas dan menonjol, seperti warna kulit, bentuk tubuh, dan logat bahasa. Berdasarkan teori kognitif, prasangka timbul karena adanya atribusi dan perbedaan antara in group dan out group Atribusi adalah proses bagaimana kita mencoba menafsirkan dan menjelaskan perilaku individu lain, yaitu untuk melihat sebab tindakan mereka. Menurut teori atribusi, prasangka disebabkan oleh individu sebagai pengamat melakukan atribusi yang bias terhadap target prasangka. Thomas Pettigrew (1979), Emmot,Pettigrew, dan Johnson (1983) mengemukakan bahwa individu yang berprasangka cenderung melakukan ultimate attribution error, yang merupakan perluasan dari fundamental attribution error. Pettigrew juga menyebutkan adanya ketidakkonsistenan atribusi individu yang berprasangka terjadi karena target prasangka menunjukkan perilaku positif, yaitu Menurut teori psikodinamika, prasangka adalah agresi yang dialihkan. Pengalihan agresi terjadi apabila sumber frustasi tidak dapat diserang karena rasatakut dan sumber frustasi itu benar-benar tidak ada. Prasangka juga dapat timbulakibat terganggunya fungsi psikologis dalam diri individu tersebut.Berdasarkan teori psikodinamika, prasangka timbul karena adanya rasafrustasi dan kepribadian yang otoriter Dunia merupakan kekompleksan yang tiada batas. Melalui kategorisasi kita membuatnya menjadi sederhana dan bisa kita mengerti. Melalui kategorisasi kita membedakan diri kita dengan orang lain, keluarga kita dengan keluarga lain,kelompok kita dengan kelompok lain, etnik kita dengan etnik lain. Pembedaan kategori ini bisa berdasarkan persamaan atau perbedaan. Misalnya persamaan tempat tinggal, garis keturunan, warna kulit, pekerjaan, kekayaan yang relatif sama dan sebagainya akan dikategorikan dalam kelompok yang sama. Sedangkan perbedaan dalam warna kulit, usia, jenis kelamin, tempat tinggal, pekerjaan,tingkat pendidikan dan lainnya maka dikategorikan dalam kelompok yang berbeda. Mereka yang memiliki kesamaan dengan diri kita akan dinilai satu kelompok dengan kita atau in group . Sedangkan mereka yang berbeda dengan kita akan dikategorikan sebagai out group. Seseorang pada saat yang sama bias dikategorikan dalam in group ataupun out group sekaligus. Misalnya Sandi adalah tetangga kita, jadi sama-sama sebagai anggota kelompok pertetanggaan lingkungan RT. Pada saat yang sama ia merupakan lawan kita karena ia bekerja pada perusahaan saingan kita. Jadi, Sandi termasuk satu kelompok dengan kita (ingroup) sekaligus bukan sekelompok dengan kita (out group) . Kategorisasi memiliki dua efek fundamental yakni melebih-lebihkan perbedaan antar kelompok dan meningkatkan kesamaan kelompok sendiri. Perbedaan antar kelompok yang ada cenderung dibesar-besarkan dan itu yang sering di ekspos sementara kesamaan yang ada cenderung untuk diabaikan. Disisilain kesamaan yang dimiliki oleh kelompok cenderung sangat dilebih-lebihkan dan itu pula yang selalu diungkapkan. Sementara itu perbedaan yang ada cenderung diabaikan. Sebagai contoh perbedaan antara etnik jawa dan etnik batak akan cenderung di lebih-lebihkan, misalnya dalam bertutur kata di mana etnis jawa lembut dan etnis Batak kasar. Lalu, orang-orang seetnis cenderung untuk merasa sangat identik satu sama lain padahal sebenarnya di antara mereka relatif cukup berbeda. Ukuran kelompok adalah faktor penting dalam menilai apakah di antara anggota-anggotanya relatif sama ataukah plural. Kelompok minoritas menilai dirinya lebih similar dalam kelompok, sementara kelompok mayoritas menilai dirinya kurang similar. Anggota kelompok minoritas juga mengidentifikasikan diri lebih kuat ke dalam kelompok ketimbang anggota kelompok yang lebih besar. Kelompok yang minoritas juga menilai dirinya lebih berada di dalam ancaman dibanding kelompok yang lebih besar. Keadaan ini menyebabkan kelompok minoritas tidak mudah percaya, sangat berhati-hati dan lebih mudah berprasangka terhadap kelompok mayoritas. Kecemasan berlebih itu tidak kondusif dalam harmonisasi hubungan sosial. Karena sebagaimana yang dikatakan oleh Islam dan Hewstone (1993) hubungan yang cenderung meningkatkan kecemasan akan mengurangi sikap yang baik terhadap kelompok lain. Pengkategorian cenderung mengkontraskan antara dua pihak yang berbeda. Jika yang satu dinilai baik maka kelompok lain cenderung dinilai buruk. Kelompok sendiri biasanya akan dinilai baik, superior, dan layak dibangga kanuntuk meningkatkan harga diri. Sementara itu disaat yang sama, kelompok lain cenderung dianggap buruk, inferior, dan memalukan. Keadaan ini bias menimbulkan konflik karena masing-masing kelompok merasa paling baik. Keadaan konflik ini baik terbuka ataupun tidak melahirkan prasangka. Oakes, Haslam Turner (1994) menyatakan bahwa kategorisasi sosial juga akanmelahirkan diskriminasi antar kelompok jika memenuhi kondisi berikut Derajat subjek mengidentifikasi dengan kelompoknya. Semakin tinggi derajat identifikasi terhadap kelompok semakin tinggi kemungkinan melakukan diskriminasi. Menonjol tidaknya kelompok lain yang relevan. Bila kelompok yang relevan cukup menonjol maka kecenderungan untuk terjadi diskriminasi juga besar. Derajat di mana kelompok dibandingkan pada dimensi-dimensi itu (kesamaan,kedekatan, perbedaan yang ambigu). Semakin sama, semakin dekat, dan semakin ambigu yang dibandingkan maka kemungkinan diskriminasi akan mengecil. Penting dan relevankah membandingkan dimensi-dimensi dengan identitas kelompok. Semakin penting dan relevan dimensi yang dibandingkan dengan identitas kelompok maka kemungkinan diskriminasi juga semakin besar.Status relatif in group dan karakter perbedaan status antar kelompok yang dirasakan. Semakin besar perbedaan yang dirasakan maka diskriminasi juga semakin mungkin terjadi",formal_document,0,human
formal_e26cbdd7,"Sejarah radio adalah sejarah teknologi yang menghasilkan peralatan radio yang menggunakan gelombang radio. Awalnya sinyal pada siaran radio ditransmisikan melalui gelombang data yang kontinyu baik melalui modulasi amplitudo (AM), maupun modulasi frekuensi (FM). Metode pengiriman sinyal seperti ini disebut analog. Selanjutnya, seiring perkembangan teknologi ditemukanlah internet, dan sinyal digital yang kemudian mengubah cara transmisi sinyal radio Sejarah Penggunaan Radio Rata-rata pengguna awal radio adalah para maritim, yang menggunakan radio untuk mengirimkan pesan telegraf menggunakan kode morse antara kapal dan darat. Salah satu pengguna awal termasuk Angkatan Laut Jepang yang memata-matai armada Rusia saat Perang Tsushima pada tahun 1901. Salah satu penggunaan yang paling dikenang adalah saat tenggelamnya RMS Titanic pada tahun 1912, termasuk komunikasi antara operator di kapal yang tenggelam dengan kapal terdekat dan komunikasi ke stasiun darat. Radio digunakan untuk menyalurkan perintah dan komunikasi antara Angkatan Darat dan Angkatan Laut di kedua pihak pada Perang Dunia II Jerman menggunakan komunikasi radio untuk pesan diplomatik ketika kabel bawah lautnya dipotong oleh Britania. Amerika Serikat menyampaikan Program 14 Titik Presiden Woodrow Wilson kepada Jerman melalui radio ketika perang. Siaran mulai dapat dilakukan pada 1920-an, dengan populernya pesawat radio, terutama di Eropa dan Amerika Serikat. Selain siaran, siaran titik-ke-titik, termasuk telepon dan siaran ulang program radio, menjadi populer pada 1920-an dan 1930-an Penggunaan radio dalam masa sebelum perang adalah untuk mengembangan pendeteksian dan pelokasian pesawat dan kapal dengan penggunaan radar. Sekarang, radio banyak bentuknya, termasuk jaringan tanpa kabel, komunikasi bergerak di segala jenis, dan juga penyiaran radio. Sebelum televisi terkenal, siaran radio komersial termasuk drama, komedi, beragam show, dan banyak hiburan lainnya tidak hanya berita dan musik saja. Radio AM Radio AM (modulasi amplitudo) bekerja dengan prinsip memodulasikan gelombang radio dan gelombang audio. Kedua gelombangg ini sama-sama memiliki amplitudo yang konstan. Namun proses modulasi ini kemudian mengubah amplitudo gelombang penghantar (radio) sesuai dengan amplitudo gelombang audio. Pada tahun 1896 ilmuwan Italia, Guglielmo Marconi mendapat hak paten atas telegraf nirkabel yang menggunakan dua sirkuit. Pada saat itu sinyal ini hanya bisa dikirim pada jarak dekat. Namun, hal inilah yang memulai perkembangan teknologi radio. Pada tahun 1897 Marconi kembali mempublikasikan penemuan bahwa sinyal nirkabel dapat ditransmisikan pada jarak yang lebih jauh (12 mil). Selanjutnya, pada 1899 Marconi berhasil melakukan komunikasi nirkabel antara Perancis dan Inggris lewat Selat Inggris dengan menggunakan osilator Tesla. John Ambrose Fleming pada tahun 1904 menemukan bahwa tabung audion dapat digunakan sebagai receiver nirkabel bagi teknologi radio ini. Dua tahun kemudian Dr. Lee deForest menemukan tabung elektron yang terdiri dari tiga elemen (triode audion). Penemuan ini memungkinkan gelombang suara ditransmisikan melalui sistem komunikasi nirkabel. Tetapi sinyal yang ditangkap masih sangat lemah. Barulah pada tahun 1912 Edwin Howard Armstrong menemukan penguat gelombang radio disebut juga radio amplifier. Alat ini bekerja dengan cara menangkap sinyal elektromagnetik dari transmisi radio dan memberikan sinyal balik dari tabung. Dengan begitu kekuatan sinyal akan meningkat sebanyak 20.000 kali perdetik. Suara yang ditangkap juga jauh lebih kuat sehingga bisa didengar langsung tanpa menggunakan earphone. Penemuan ini kemudian menjadi sangat penting dalam sistem komunikasi radio karena jauh lebih efisien dibandingkan alat terdahulu. Meskipun demikian hak paten atas amplifier jatuh ke tangan Dr. Lee deforest. Sampai saat ini radio amplifier masih menjadi teknologi inti pada pesawat radio. Awalnya penggunanaan radio AM hanya untuk keperluan telegram nirkabel. Orang pertama yang melakukan siaran radio dengan suara manusia adalah Reginald Aubrey Fessenden. Ia melakukan siaran radio pertama dengan suara Sejarah radio 2 manusia pada 23 Desember 1900 pada jarak 50 mil (dari Cobb Island ke Arlington, Virginia) Saat ini radio AM tidak terlalu banyak digunakan untuk siaran radio komersial karena kualitas suara yang buruk. Radio FM Radio FM (modulasi frekuensi) bekerja dengan prinsip yang serupa dengan radio AM, yaitu dengan memodulasi gelombang radio (penghantar) dengan gelombang audio. Hanya saja, pada radio FM proses modulasi ini menyebabkan perubahan pada frekuensi. Ketika radio AM umum digunakan, Armstrong menemukan bahwa masalah lain radio terletak pada jenis sinyal yang ditransmisikan. Pada saat itu gelombang audio ditransmisikan bersama gelombang radio dengan menggunakan modulasi amplitudo (AM). Modulasi ini sangat rentan akan gangguan cuaca. Pada akhir 1920-an Armstrong mulai mencoba menggunakan modulasi dimana amplitudo gelombang penghantar (radio) dibuat konstan. Pada tahun 1933 ia akhirnya menemukan sistem modulasi frekuensi (FM) yang menghasilkan suara jauh lebih jernih, serta tidak terganggu oleh cuaca buruk. Sayangnya teknologi ini tidak serta merta digunakan secara massal. Depresi ekonomi pada tahun 1930-an menyebabkan industri radio enggan mengadopsi sistem baru ini karena mengharuskan penggantian transmiter dan receiver yang memakan banyak biaya. Baru pada tahun 1940 Armstrong bisa mendirikan stasiun radio FM pertama dengan biayanya sendiri. Dua tahun kemudian Federal Communication Comission (FCC) mengalokasikan beberapa frekuensi untuk stasiun radio FM yang dibangun Armstrong. Perlu waktu lama bagi modulasi frekuensi untuk menjadi sistem yang digunakan secara luas. Selain itu hak paten juga tidak kunjung didapatkan oleh Armstrong. Frustasi akan segala kesulitan dalam memperjuangkan sistem FM, Armstrong mengakhiri hidupnya secara tragis dengan cara bunuh diri. Beruntung istrinya kemudian berhasil memperjuangkan hak-hak Armstrong atas penemuannya. Barulah pada akhir 1960-an FM menjadi sistem yang benar-benar mapan. Hampir 2000 stasiun radio FM tersebar di Amerika, FM menjadi penyokong gelombang mikro (microwave), pada akhirnya FM benar-benar diakui sebagai sistem unggulan di berbagai bidang komunikasi. Radio internet Penemuan internet mulai mengubah transmisi sinyal analog yang digunakan oleh radio konvensional. Radio internet (dikenal juga sebagai web radio, radio streaming dan e-radio) bekerja dengan cara mentransmisikan gelombang suara lewat internet. Prinsip kerjanya hampir sama dengan radio konvensional yang gelombang pendek (short wave), yaitu dengan menggunakan medium streaming berupa gelombang yang kontinyu. Sistem kerja ini memungkinkan siaran radio terdengar ke seluruh dunia asalkan pendengar memiliki perangkat internet. Itulah sebabnya banyak kaum ekspatriat yang menggunakan radio internet untuk mengobanti rasa kangen pada negara asalnya. Di Indonesia, umumnya radio internet dikolaborasikan dengan sistem radio analog oleh stasiun radio teresterial untuk memperluas jangkauan siarannya. Radio satelit Radio satelit mentransmisikan gelombang audio menggunakan sinyal digital. Berbeda dengan sinyal analog yang menggunakan gelombang kontinyu, gelombang suara ditransmisikan melalui sinyal digital yang terdiri atas kode-kode biner 0 dan 1. Sinyal ini ditransmisikan ke daerah jangkauan yang jauh lebih luas karena menggunakan satelit. Hanya saja siaran radio hanya dapat diterima oleh perangkat khusus yang bisa menerjemahkan sinyal terenkripsi. Siaran radio satelit juga hanya bisa diterima di tempat terbuka dimana antena pada pesawat radio memiliki garis pandang dengan satelit pemancar. Radio satelit hanya bisa bekerja yang tidak memiliki penghalang besar seperti terowongan atau gedung. Oleh karena itu perangkat radio satelit banyak dipromosikan untuk radio mobil. Untuk mendapat transmisi siaran yang baik, perlu dibuat stasiun repeater seperti di Amerika agar kualitas layanan prima. Sejarah radio 3 Perangkat yang mahal (karena menggunakan satelit) membuat sistem ini komersil. Pendengar harus berlangganan untuk dapat mendengarkan siaran radio. Meskipun begitu kualitas suara yang dihasilkan sangat jernih, tidak lagi terdapat noise seperti siaran radio konvensional. Selain itu sebagian besar isi siaran juga bebas iklan dan pendengar memiliki jauh lebih banyak pilihan kanal siaran (lebih dari 120 kanal). Perusahaan penyedia satelit radio dunia adalah Worldspace yang melayani siaran radio satelit di Amerika, Eropa, Asia, Australia, dan Afrika. Worldspace memiliki tiga satelit yang melayani wilayah berbeda. Di Indonesia, samapai tahun 2002 Worldspace telah bekerja sama dengan RRI, Radio trijaya, Borneo Wave Channel (Masima Group), goindo.com dan Kompas Cyber Media sebagai pengisi konten layanan radio satelit dengan menggunakan satelit Asia Star. mbs fm suci manyar gresik Radio berdefinisi tinggi (HD Radio) Radio yang dikenal juga sebagai radio digital ini bekerja dengan menggabungkan sistem analog dan digital sekaligus. Dengan begitu memungkinkan dua stasiun digital dan analog berbagi frekuensi yang sama. Efisiensi ini membuat banyak konten bisa disiarkan pada posisi yang sama. Kualitas suara yang dihasilkan HD radio sama jernihnya dengan radio satelit, tetapi layanan yang ditawarkan gratis. Namun untuk dapat menerima siaran radio digital pendengar harus memiliki perangkat khusus yang dapat menangkap sinyal digital.",formal_document,0,human
